tutor_prompt,student_persona,course,exercise_number,judge_prompt,judge_rubric,transcript_name,deductions
tutor_01,chaotic_01,philosophy,01,judge_02,rubric_02,transcript_01,"1_pedagogy/1.3: Limited explicit meta-learning/methodology discussion beyond refusing to provide a paste-in answer; little explanation of the learning strategy or process feedback beyond immediate task guidance.
2_dialogue_quality/2.2: Prompt required applying act consequentialism to Fuel and Blood, but the dialogue never anchored back with actual case details or verdicts; instead it used a generic bridge sentence without meeting the assignment’s case-specific constraint.
2_dialogue_quality/2.3: Clear progress on trolley cases and a general account, but the conversation does not reach completion on Fuel/Blood specifics, leaving a key part of the assignment underdeveloped."
tutor_01,clueless_02,philosophy,01,judge_02,rubric_02,transcript_01,"1_pedagogy/1.3: Tutor rarely makes the meta-pedagogical rationale explicit (e.g., why use questions/why avoid giving answers) and does not clearly note that feedback is formative rather than replacing instructor judgment. | 3_communication_quality/3.1: Some tutor turns are somewhat dense/compound (multiple numbered tasks at once) where more bite-sized prompts could reduce cognitive load, though overall clarity remains good. | 3_communication_quality/3.2: Tutor gives evaluative feedback (e.g., 'coherent') but does not explicitly clarify it is formative and not a substitute for instructor grading/judgment."
tutor_01,chaotic_01,philosophy,01,judge_02,rubric_02,transcript_02,"1_pedagogy/1.3: Limited explicit meta-learning rationale for refusing to write the submission; mostly enforced boundary without explaining the learning/ownership purpose.
3_communication_quality/3.3: Occasional formatting/medium mismatch: provided 'paste-able skeleton' and multiple sentence-level 'options' that could be copied verbatim, slightly blurring intent though not confusing."
tutor_01,clueless_02,urban_studies,01,judge_02,rubric_02,transcript_02,1_pedagogy/1.3: Limited explicit meta-learning explanation of why the tutor is refusing to provide specific answers/citations beyond a brief boundary statement; most guidance is procedural but not framed as a learning strategy.
tutor_01,chaotic_01,urban_studies,01,judge_02,rubric_02,transcript_03,"1_pedagogy/1.3: Limited explicit meta-learning/process feedback beyond boundary-setting; could more clearly explain how to evaluate source quality/appropriateness (e.g., Wikipedia vs primary sources) and frame choices as methodological learning.
3_communication_quality/3.2: At times tone is firm without much affective support when the student is stressed/time-constrained; still professional but could better acknowledge constraints while redirecting."
